{
  "schema_version": 1,

  "identification": {
    "name":       "Baltic Birch Plywood",
    "slug":       "birch-plywood",
    "category":   "Natural Material",
    "fabrication_processes": ["Machining"],
    "common_forms": ["Sheet"],
    "common_form_notes": "Standard 4×8 ft sheets, 3–25 mm thickness; laser-cutting grade typically 3–6 mm",
    "usage_frequency": "Common",
    "notes": "Baltic birch plywood is an orthotropic material; properties depend strongly on direction relative to face grain. Young's modulus, tensile strength, and compressive strength values given are approximately along the face grain direction (the structurally dominant direction for flat panels). CTE (coefficient of thermal expansion) is a representative in-plane value; through-thickness CTE is substantially higher. Janka hardness approximately 1260 lbf (5.6 kN) for yellow birch; standard hardness scales (HV (Vickers hardness), HB (Brinell hardness), Rockwell) are not applicable to plywood. Glue line performance degrades above ~60°C. All properties are moisture-content dependent. Thermal diffusivity is derived from thermal conductivity (k), density (ρ), and specific heat (Cp) — not an independently measured value."
  },

  "typical_usage": "Laser-cut structural panels, maker/prototype enclosures, jigs and fixtures, model fabrication, and lightweight stiff panels in capstone design projects. Preferred for laser cutting due to consistent ply structure and minimal voids.",

  "mechanical_common": {
    "youngs_modulus":       { "value": 10.0,  "ref": "usda-wood-handbook" },
    "poissons_ratio":       { "value": null,  "ref": null },
    "yield_strength":       { "value": null,  "ref": null },
    "tensile_strength":     { "value": 0.045, "ref": "usda-wood-handbook" },
    "compressive_modulus":  { "value": null,  "ref": null },
    "compressive_strength": { "value": 30,    "ref": "usda-wood-handbook" },
    "usable_temp_range":    { "min": -20, "max": 60, "ref": "usda-wood-handbook" }
  },

  "mechanical_other": {
    "microyield_strength":  { "value": null, "ref": null },
    "creep_strength":       { "value": null, "ref": null },
    "fatigue_sn_curve":     { "points": [], "ref": null },
    "fracture_toughness":   { "value": null, "ref": null },
    "hardness_vickers":     { "value": null, "ref": null },
    "hardness_brinell":     { "value": null, "ref": null },
    "hardness_rockwell":    { "value": null, "scale": null, "ref": null },
    "hardness_shore":       { "value": null, "scale": null, "ref": null },
    "ductility":            { "min": null, "max": null, "typical": null, "ref": null },
    "shear_strength":       { "value": null, "ref": null }
  },

  "physical": {
    "density":                { "value": 0.68, "ref": "usda-wood-handbook" },
    "electrical_conductivity":{ "value": null, "ref": null },
    "vapour_pressure":        { "value": null, "ref": null },
    "thermal_expansion": {
      "value": 5.0,
      "table": [],
      "ref": "usda-wood-handbook"
    },
    "thermal_conductivity": {
      "value": 0.17,
      "table": [],
      "ref": "usda-wood-handbook"
    },
    "specific_heat": {
      "value": 1700,
      "table": [],
      "ref": "usda-wood-handbook"
    },
    "thermal_diffusivity":    { "value": 0.0015, "ref": null },
    "melting_point_tm":       { "value": null,   "ref": null },
    "glass_transition_tg":    { "value": null,   "ref": null },
    "magnetic_classification":{ "value": "Diamagnetic", "ref": null }
  },

  "references": ["usda-wood-handbook"],

  "metadata": {
    "submitted_by":  "scroberts",
    "submitted_date": "2026-05-16",
    "approved_by":   "scroberts",
    "approved_date": "2026-05-16"
  }
}
