{
  "schema_version": 1,
  "identification": {
    "name": "Titanium Ti-6Al-4V (Annealed)",
    "slug": "titanium-6al-4v",
    "category": "Metal",
    "fabrication_processes": ["Machining", "Welding"],
    "common_forms": ["Sheet", "Plate", "Round Bar"],
    "common_form_notes": "Widely available from aerospace metal distributors as AMS 4928 bar, AMS 4911 sheet/plate, and AMS 4928 billet. Machining requires sharp carbide tooling, low cutting speeds, and flood coolant to manage low thermal conductivity and work-hardening tendency. For metal-AM-printed parts, see the dedicated Titanium Ti-6Al-4V Grade 5 (DMLS, Heat Treated) entry in this database rather than this wrought/annealed entry.",
    "usage_frequency": "Common",
    "notes": "Ti-6Al-4V (UNS (Unified Numbering System) R56400, also written Ti 6-4) is the most widely used titanium alloy, accounting for ~50% of global titanium production. Properties given are for the fully annealed condition per AMS (Aerospace Material Specification) 4928. Thermal conductivity is very low (~1/6 that of steel) — this governs machining practice and is a design consideration for heat-dissipating structures. Do not use for sustained structural loads above ~315 °C as strength falls off significantly. Corrosion resistance is excellent in most environments (seawater, acids, body fluids) due to a stable TiO₂ surface layer — avoid contact with liquid oxygen, red fuming nitric acid, and chlorine at elevated temperatures. Biocompatible per ISO (International Organization for Standardization) 5832-3. Shear strength derived from von Mises criterion: UTS (ultimate tensile strength)/√3 = 950/√3 ≈ 549 MPa. Cryogenic thermal conductivity k(T) and coefficient of thermal expansion CTE(T) table data (each as a function of temperature T) are from the NIST (National Institute of Standards and Technology) Cryogenic Materials Database (nist-cryo-ti64); CTE table values are instantaneous coefficients derived from NIST polynomial fits. Melting point is solidus (1604°C); liquidus 1660°C."
  },

  "typical_usage": "Aerospace primary structures (airframe brackets, engine mounts, fan blades); biomedical implants (orthopaedic stems, bone screws, dental implants); marine hardware and fasteners in salt water; high-performance automotive and motorsport components; chemical processing equipment in corrosive environments; sports equipment (bicycle frames, golf club heads).",

  "mechanical_common": {
    "youngs_modulus":      { "value": 114,   "ref": "asm-matweb-ti64" },
    "poissons_ratio":      { "value": 0.342, "ref": "asm-matweb-ti64" },
    "yield_strength":      { "value": 0.880, "ref": "asm-matweb-ti64" },
    "tensile_strength":    { "value": 0.950, "ref": "asm-matweb-ti64" },
    "compressive_modulus": { "value": null,  "ref": null },
    "compressive_strength":{ "value": 970,   "ref": "asm-matweb-ti64" },
    "usable_temp_range":   { "min": -196, "max": 315, "ref": null }
  },

  "mechanical_other": {
    "microyield_strength": { "value": null,  "ref": null },
    "creep_strength":      { "value": null,  "ref": null },
    "fatigue_sn_curve":    { "points": [], "ref": null },
    "fracture_toughness":  { "value": 75,    "ref": "asm-matweb-ti64" },
    "hardness_vickers":    { "value": 340,   "ref": "asm-matweb-ti64" },
    "hardness_brinell":    { "value": null,  "ref": null },
    "hardness_rockwell":   { "value": null,  "scale": null, "ref": null },
    "hardness_shore":    { "value": null, "scale": null, "ref": null },
    "ductility":           { "min": 10, "max": 17, "typical": 14, "ref": "asm-matweb-ti64" },
    "shear_strength":      { "value": 0.549, "ref": null }
  },

  "physical": {
    "density":                { "value": 4.43,  "ref": "asm-matweb-ti64" },
    "electrical_conductivity":{ "value": 1.0,   "ref": null },
    "vapour_pressure":        { "value": null,   "ref": null },
    "thermal_expansion": {
      "value": 8.6,
      "table": [
        { "temp": -196, "cte": 4.00 },
        { "temp": -123, "cte": 7.48 },
        { "temp": -73,  "cte": 8.56 },
        { "temp": 0,    "cte": 8.21 },
        { "temp": 27,   "cte": 7.50 }
      ],
      "ref": "nist-cryo-ti64"
    },
    "thermal_conductivity":   { "value": 6.7, "table": [
      { "temp": -196, "k": 3.47 },
      { "temp": -123, "k": 4.62 },
      { "temp": -73,  "k": 5.75 },
      { "temp": 0,    "k": 6.95 },
      { "temp": 27,   "k": 7.56 }
    ], "ref": "nist-cryo-ti64" },
    "specific_heat":          { "value": 560, "table": [],   "ref": "asm-matweb-ti64" },
    "thermal_diffusivity":    { "value": null,   "ref": null },
    "melting_point_tm":       { "value": 1604,  "ref": "asm-matweb-ti64" },
    "glass_transition_tg":    { "value": null,   "ref": null },
    "magnetic_classification":{ "value": "Paramagnetic", "ref": null }
  },

  "references": ["asm-matweb-ti64", "nist-cryo-ti64"],

  "metadata": {
    "submitted_by": "admin",
    "submitted_date": "2026-05-15",
    "approved_by": "admin",
    "approved_date": "2026-05-15"
  }
}
