{
  "schema_version": 1,
  "identification": {
    "name": "E-Glass / Epoxy (Woven, NEMA G-10)",
    "slug": "gfrp-woven",
    "category": "Composite",
    "fabrication_processes": ["Composite Layup", "Vacuum Infusion", "Machining"],
    "common_forms": ["Sheet", "Plate"],
    "common_form_notes": "Available as FR-4 (a flame-retardant grade designation) / NEMA (National Electrical Manufacturers Association) G-10 laminate sheet from electrical/insulation suppliers. Machines well with carbide tooling; avoid excessive heat during cutting to prevent delamination.",
    "usage_frequency": "Common",
    "notes": "Woven E-glass fabric / epoxy laminate per NEMA (National Electrical Manufacturers Association) Grade G-10 standard. Properties are for the in-plane (warp/fill) directions; a balanced weave makes properties approximately equal in both directions. Through-thickness tensile strength and interlaminar shear strength are much lower than in-plane values (typically 30–50 MPa) — design against delamination in peel or through-thickness loading. Shear strength is the in-plane measured value from NEMA G-10 data; von Mises derivation does not apply to composite materials. The epoxy matrix is a thermoset: no melting point; maximum service temperature is controlled by the matrix glass transition temperature, Tg (~130 °C for standard FR-4, a common flame-retardant fibreglass-epoxy grade). Not suitable for sustained loads at elevated temperature without specific creep data. Ductility values represent strain to fracture (brittle failure); there is no plastic yield."
  },

  "typical_usage": "Electrical insulation panels and PCB (printed circuit board) substrates (FR-4), structural laminates in moisture-sensitive environments, jigs and fixtures, tooling plates, machine guards, and general-purpose composite sheet where moderate stiffness, electrical insulation, and low cost are required.",

  "mechanical_common": {
    "youngs_modulus":      { "value": 20.0,  "ref": "makeitfrom-g10" },
    "poissons_ratio":      { "value": 0.25,  "ref": "makeitfrom-g10" },
    "yield_strength":      { "value": null,  "ref": null },
    "tensile_strength":    { "value": 0.270, "ref": "makeitfrom-g10" },
    "compressive_modulus": { "value": null,  "ref": null },
    "compressive_strength":{ "value": 300,   "ref": "makeitfrom-g10" },
    "usable_temp_range":   { "min": -60, "max": 130, "ref": "makeitfrom-g10" }
  },

  "mechanical_other": {
    "microyield_strength": { "value": null,  "ref": null },
    "creep_strength":      { "value": null,  "ref": null },
    "fracture_toughness":  { "value": null,  "ref": null },
    "hardness_vickers":    { "value": null,  "ref": null },
    "hardness_brinell":    { "value": null,  "ref": null },
    "hardness_rockwell":   { "value": null,  "scale": null, "ref": null },
    "hardness_shore":    { "value": null, "scale": null, "ref": null },
    "ductility":           { "min": 0, "max": 2, "typical": null, "ref": "makeitfrom-g10" },
    "shear_strength":      { "value": 0.130, "ref": "makeitfrom-g10" }
  },

  "physical": {
    "density":                { "value": 1.8,  "ref": "makeitfrom-g10" },
    "electrical_conductivity":{ "value": null,  "ref": null },
    "vapour_pressure":        { "value": null,  "ref": null },
    "thermal_expansion": {
      "value": 9.0,
      "table": [],
      "ref": "makeitfrom-g10"
    },
    "thermal_conductivity":   { "value": 0.35, "table": [], "ref": null },
    "specific_heat":          { "value": 1000, "table": [], "ref": null },
    "thermal_diffusivity":    { "value": null,  "ref": null },
    "melting_point_tm":       { "value": null,  "ref": null },
    "glass_transition_tg":    { "value": 130,  "ref": "makeitfrom-g10" },
    "magnetic_classification":{ "value": "Diamagnetic", "ref": null }
  },

  "references": ["makeitfrom-g10"],

  "metadata": {
    "submitted_by": "admin",
    "submitted_date": "2026-05-15",
    "approved_by": "admin",
    "approved_date": "2026-05-15"
  }
}
