{
  "schema_version": 1,
  "identification": {
    "name": "ABS (FDM 3D Printed)",
    "slug": "abs-fdm",
    "category": "Plastic",
    "fabrication_processes": ["3D Print (FDM)"],
    "common_forms": ["Filament"],
    "common_form_notes": "1.75 mm and 2.85 mm diameter filament. Requires heated bed and enclosure to prevent warping.",
    "usage_frequency": "Common",
    "notes": "Acrylonitrile Butadiene Styrene printed via Fused Deposition Modelling (FDM). Properties are for printed parts and are anisotropic — inter-layer (Z-axis) strength is typically 40–60% of in-plane (XY) strength. Max service temperature per Simplify3D; above ~80 °C parts begin to soften noticeably. Requires enclosure to prevent warping on large prints. Emits styrene fumes during printing — ventilate or use enclosure with filtration. Impact resistant and heat resistant compared to PLA and PETG."
  },

  "typical_usage": "Enclosures, housings, brackets, jigs and fixtures, functional prototypes, automotive interior parts, and any printed part requiring higher service temperature than PLA with good impact resistance.",

  "mechanical_common": {
    "youngs_modulus":      { "value": 2.2,  "ref": "callister2020" },
    "poissons_ratio":      { "value": 0.35, "ref": "callister2020" },
    "yield_strength":      { "value": null, "ref": null },
    "tensile_strength":    { "value": 0.040, "ref": "simplify3d-materials-guide" },
    "compressive_modulus": { "value": null, "ref": null },
    "compressive_strength":{ "value": null, "ref": null },
    "usable_temp_range":   { "min": -40, "max": 98, "ref": "simplify3d-materials-guide" }
  },

  "mechanical_other": {
    "microyield_strength": { "value": null, "ref": null },
    "creep_strength":      { "value": null, "ref": null },
    "fracture_toughness":  { "value": null, "ref": null },
    "hardness_vickers":    { "value": null, "ref": null },
    "hardness_brinell":    { "value": null, "ref": null },
    "hardness_rockwell":   { "value": null, "scale": null, "ref": null },
    "hardness_shore":    { "value": null, "scale": null, "ref": null },
    "shear_strength":      { "value": null, "ref": null }
  },

  "physical": {
    "density":                { "value": 1.04, "ref": "simplify3d-materials-guide" },
    "electrical_conductivity":{ "value": null, "ref": null },
    "vapour_pressure":        { "value": null, "ref": null },
    "thermal_expansion": {
      "value": 90,
      "table": [
        { "temp": 20, "cte": 90 }
      ],
      "ref": "simplify3d-materials-guide"
    },
    "thermal_conductivity":{ "value": 0.17, "table": [],  "ref": "callister2020" },
    "specific_heat":       { "value": 1400, "table": [],  "ref": "callister2020" },
    "thermal_diffusivity": { "value": null,  "ref": null },
    "melting_point_tm":    { "value": null,  "ref": null },
    "glass_transition_tg": { "value": 100,   "ref": "callister2020" },
    "magnetic_classification": { "value": "Diamagnetic", "ref": null }
  },

  "references": ["simplify3d-materials-guide", "callister2020"],

  "metadata": {
    "submitted_by": "admin",
    "submitted_date": "2026-05-14",
    "approved_by": "admin",
    "approved_date": "2026-05-14"
  }
}
