{
  "schema_version": 1,
  "identification": {
    "name": "Aluminum 7075-T6",
    "slug": "aluminum-7075-t6",
    "category": "Metal",
    "fabrication_processes": ["Machining"],
    "common_forms": ["Sheet", "Plate", "Round Bar"],
    "common_form_notes": "Widely stocked as plate, sheet, and bar. Typically purchased in T6 or T651 temper (stress-relieved plate). Not recommended for welding in most applications.",
    "usage_frequency": "Common",
    "notes": "Al-Zn-Mg-Cu alloy (7xxx series). T6 temper: solution heat-treated and artificially aged. The highest-strength commonly available aluminum alloy. Susceptible to stress-corrosion cracking (SCC) in sustained tensile loading — T73 or T7351 tempers provide better SCC resistance at the cost of ~15% strength reduction. Not recommended for fusion welding. All mechanical properties from MIL-HDBK-5J (freely available); eFunda linked for cross-reference. Cryogenic CTE table entries (−196 to −100 °C) are instantaneous values from the NIST Cryogenic Materials Database polynomial for wrought aluminium alloys (6061-T6 polynomial used as proxy; dedicated 7075 polynomial not published — all wrought Al alloys agree within ±4%). Above-RT CTE from MIL-HDBK-5J."
  },

  "typical_usage": "Aerospace structural members, aircraft fittings and bulkheads, high-performance bicycle frames, rock climbing equipment, competitive cycling components, and any application requiring maximum specific strength in aluminum.",

  "mechanical_common": {
    "youngs_modulus":      { "value": 71.7,  "ref": "mil-hdbk-5j-2003" },
    "poissons_ratio":      { "value": 0.33,  "ref": "mil-hdbk-5j-2003" },
    "yield_strength":      { "value": 0.503, "ref": "mil-hdbk-5j-2003" },
    "tensile_strength":    { "value": 0.572, "ref": "mil-hdbk-5j-2003" },
    "compressive_modulus": { "value": null,  "ref": null },
    "compressive_strength":{ "value": 462,   "ref": "mil-hdbk-5j-2003" },
    "usable_temp_range":   { "min": -196, "max": 125, "ref": "mil-hdbk-5j-2003" }
  },

  "mechanical_other": {
    "microyield_strength": { "value": null, "ref": null },
    "creep_strength":      { "value": null, "ref": null },
    "fatigue_sn_curve": {
      "points": [
        { "stress": 0.310, "cycles": 100000 },
        { "stress": 0.230, "cycles": 1000000 },
        { "stress": 0.165, "cycles": 10000000 },
        { "stress": 0.152, "cycles": 500000000 }
      ],
      "ref": "mil-hdbk-5j-2003"
    },
    "fracture_toughness":  { "value": 27,   "ref": "mil-hdbk-5j-2003" },
    "hardness_vickers":    { "value": 175,  "ref": "mil-hdbk-5j-2003" },
    "hardness_brinell":    { "value": 150,  "ref": "mil-hdbk-5j-2003" },
    "hardness_rockwell":   { "value": 87, "scale": "B", "ref": "mil-hdbk-5j-2003" },
    "hardness_shore":    { "value": null, "scale": null, "ref": null },
    "ductility":           { "min": 11, "max": null, "typical": null, "ref": "mil-hdbk-5j-2003" },
    "shear_strength":      { "value": 0.331, "ref": "mil-hdbk-5j-2003" }
  },

  "physical": {
    "density":                { "value": 2.81,  "ref": "mil-hdbk-5j-2003" },
    "electrical_conductivity":{ "value": 33.0,  "ref": "mil-hdbk-5j-2003" },
    "vapour_pressure":        { "value": null,  "ref": null },
    "thermal_expansion": {
      "value": 23.6,
      "table": [
        { "temp": -196, "cte": 8.7 },
        { "temp": -150, "cte": 14.0 },
        { "temp": -100, "cte": 18.3 },
        { "temp": 20,   "cte": 23.6 },
        { "temp": 100,  "cte": 24.1 },
        { "temp": 200,  "cte": 24.7 }
      ],
      "ref": "nist-cryo-al"
    },
    "thermal_conductivity":{ "value": 130, "table": [],  "ref": "mil-hdbk-5j-2003" },
    "specific_heat":       { "value": 960, "table": [],  "ref": "mil-hdbk-5j-2003" },
    "thermal_diffusivity": { "value": null, "ref": null },
    "melting_point_tm":    { "value": 635,  "ref": "mil-hdbk-5j-2003" },
    "glass_transition_tg": { "value": null, "ref": null },
    "magnetic_classification": { "value": "Paramagnetic", "ref": null }
  },

  "references": ["efunda-aluminum-7075", "mil-hdbk-5j-2003", "nist-cryo-al"],

  "metadata": {
    "submitted_by": "admin",
    "submitted_date": "2026-05-14",
    "approved_by": "admin",
    "approved_date": "2026-05-14"
  }
}
